{
    "id": 12345,
    "name": "Lorem ipsum",
    "description": "Lorem ipsum dolor",
    "map": "/map/12345/",
    "pois": "/map_instance_pois/12345/",
    "metadata": {
        "created": "some time format",
        "edited": "some time format",
        "creator": "User name",
        "editor": "User name"
    }
}